hiphop,"Widzisz w koło wielu ludzi,"
hiphop,"P sam się musi chronić,"
hiphop,"Sam się musi bronić,"
hiphop,"Sam muzykę robić,"
hiphop,"Nikomu się nie żalić,"
hiphop,"Tylko dbać o swój interes,"
hiphop,A czy wiesz że rap nim nie jest?
hiphop,Nie wiesz? Przecież znasz mnie.
hiphop,"Spytaj czego nie słyszałem,"
hiphop,"Znajdź taką płytę,"
hiphop,"Znam całą klasykę,"
hiphop,"Zbyt długo w tym siedzę,"
hiphop,"Ty z mamusią przy obiedzie,"
hiphop,"A ja w sklepie hajs ostatni,"
hiphop,"Na oryginał CDek wydawałem,"
hiphop,Punkt dodatni.
hiphop,"Śmiejesz się zgadnij,"
hiphop,"Kto się będzie śmiał ostatni,"
hiphop,"Śmiejesz się zgadnij,"
hiphop,"Śmiejesz się zgadnij,"
hiphop,Gdzie prawdziwi słuchacze.
hiphop,Te twardziel co masz pod maską?
hiphop,"Zapierdolę ci gonga,"
hiphop,"Jak Planet Asia Z Rasco,"
hiphop,Dla skurwysynów fiasko
hiphop,Ku uciesze ich lasek.
hiphop,"Każda z nich z bajecznym tyłkiem,"
hiphop,"Zgrabną nóżką na obcasie,"
hiphop,"Węszy kasę, szczerzy zęby,"
hiphop,"Kocha w Peji się, wdzięczy"
hiphop,Chcecie dupeczki bym waszych fake’ów wyręczył!
hiphop,"Pozdrawiam kozaków,"
hiphop,"Na majkach niszczących łachów,"
hiphop,Zniechęcajmy ich do rapu
hiphop,Zniechęcajmy.. Zniechęcajmy...
hiphop,Wtedy jeszcze bardziej będą nienawidzić
hiphop,"Tych wszystkich, którym się udało przebić,"
hiphop,"Lirycznie robią wszystkich,"
hiphop,Chcesz się wybić dla korzyści?
hiphop,Jesteś bez szans
hiphop,"P styl ma ten sam,"
hiphop,Nie zbiedniej jak Greg Nice
hiphop,Nie wiesz kto to taki?
hiphop,No to nie rób se jaj
hiphop,Za brak podstawowej wiedzy
hiphop,Weźmiesz szajs a nie hajs
hiphop,Oto Rycha postulat
hiphop,Nie ma się co rozczulać
hiphop,Jak z faktu że Swayze zapuszkował Ja Rule’a
hiphop,Jak z faktu że Swayze zapuszkował Ja Rule’a
hiphop,Co cię boli?
hiphop,"Czy aż tak cię to boli,"
hiphop,Że Rychu Peja ma szansę
hiphop,Dziś uczciwie zarobić?
hiphop,"Przyjemne z pożytecznym,"
hiphop,"Pasja życiowa rap,"
hiphop,"Ja za ciebie nic nie zrobię,"
hiphop,A ty dziobem kłap kłap
hiphop,"Nierobie pierdolony,"
hiphop,"Zawistny Polaku,"
hiphop,"Zacznij zmieniać swoje życie,"
hiphop,Jak nie chcesz żreć ochłapów.
hiphop,Zrób coś! Słyszysz? Zacznij żyć własnym życiem
hiphop,Kłapnij jeszcze raz usłyszysz o tym na płycie
hiphop,To mój rap...
hiphop,To moja rzeczywistość...
hiphop,"Jakie życie, taki rap..."
hiphop,W nim zawarte jest wszystko...
hiphop,Więc weź to wreszcie pojmij..
hiphop,Jarzysz? Jarzysz? Kurwa jarzysz? []
hiphop,"Ciemnoo już, zgasły wszystkiee światła"
hiphop,"Ciemnoo już, noc nadchodzii, głuucha"
hiphop,"Słuchaj to, sprawdź to, to Peja Syku, Medi Top"
hiphop,"I Mefi Mef krew za krew, połączenie stref"
hiphop,Nocna rozpierducha to nie blef
hiphop,I dalej krok za krokiem w złodziei mieście
hiphop,"Czasami jest taka nuda, że dłubie się w nim"
hiphop,Jak pieprzone rodzynki w domowym cieście
hiphop,"Nadchodzą nocne mary, więc zróbcie przejście"
hiphop,"W sumie olej zadymę, dziś tylko track i rap mnie interesuje"
hiphop,Przez biznes porażony w tym mieście jak grom
hiphop,Każdemu lesterowi w mordę pluję
hiphop,"Często nocna jazda z Mefim, wtedy kontempluje"
hiphop,I tak wokoło pełno geji pizga polskę
hiphop,"A ja sam se biegam, ciągle biegam, biegam"
hiphop,Jak się coś przyklei do łapy to sprzedam
hiphop,"Wierzysz w to, to rzuć okiem na palące projekty PCP"
hiphop,"Czekam tu na ciebie, od razu dżejkiem cię skatuje"
hiphop,"Byś wczuł się w to miejsce, poczuł mistyczny"
hiphop,"Sprawdź to, ja reprezentuję moich ludzi"
hiphop,A oni reprezentują mnie
hiphop,"Obskurne czasy, skazani na piekło na ziemi, tego jestem pewien"
hiphop,Bo ciągle klepie biedę
hiphop,Samoobrona w kieszeni na zawsze na bicie
hiphop,Niosą mnie dzieciaki pogrążone w biedę
hiphop,Dalej stale wale swoją prostą przed siebie
hiphop,Robię to i tylko ode mnie zależy jak ja to na kartce uchwycę
hiphop,"Moje ukochane, brudne ulice"
hiphop,"Obnażone tak, że aż dreszcze są i tchu brak, i tchu brak."
hiphop,"Ciemnoo już, zgasły wszystkiee światła"
hiphop,"Ciemnoo już, noc nadchodzii, głuucha"
hiphop,"Głucha noc, noc głucha, ja, Wiśniowy, z nami Grucha"
hiphop,"W centrum miasta zawierucha, sto pięćdziesiąt siedem chucha"
hiphop,"Patroli prewencji fucha, zakuć nas, przetransportować"
hiphop,"Długa była noc, nie kleiła się rozmowa"
hiphop,"Do niczego się nie pucować, to Ski Składu zmowa"
hiphop,"Głupa palę, ściemniam, ściemniam, mnie tam przecież nie było"
hiphop,"Parę piwek się wypiło, z impry do domu wracałem"
hiphop,"Przecież nikogo nie tłukłem, w sklepach szyb nie wybijałem"
hiphop,"Obciążony tym zeznaniem, cztery osiem przesiedziałem"
hiphop,Wśród zgłoszeń szczekaczki z suki księżyc podziwiałem
hiphop,"Szybki dojazd na aleje, diabeł w ryj mi się śmieje"
hiphop,"Myślę sobie oszaleje, mają kolejne zgłoszenie"
hiphop,"Wyciągają mnie z klatki, straszą pójdziesz za kratki"
hiphop,Zapowiadają sanki bez rymów i szklanki
hiphop,"Ta noc była długa, najebkowicz uga-buga"
hiphop,"Wyczynia w centrum cuda, w każdy weekend pewna zguba"
hiphop,"Nieświadomy swych poczynań, wytrzeźwiej, sobie przemyśl"
hiphop,"Co w nocy wyczyniasz, raport zaliczonej gleby"
hiphop,"Głucha noc sto procent, zakazane owoce"
hiphop,Długie nieprzespane noce i patrzały podkrążone
hiphop,"Kolorowe neony, światła miasta, ja wpatrzony w to wszystko"
hiphop,"Obrazy, trasy znam na pamięć większość"
hiphop,"Wariat udowadnia męskość, szaleństwo, noce piekło"
hiphop,"Głucha noc, noc głucha Medi Top i Mefi słuchaj"
hiphop,"Jeden z drugim wariaty, chłonie noc nowe ofiary"
hiphop,"Ja odbijam dziś do chaty, bo chce dziś uniknąć kary"
hiphop,"Za szaleństwo noc głucha, głucha noc pewna zguba"
hiphop,"Głucha noc pewna zguba, to piekło pewna zguba"
hiphop,"Ciemnoo już, zgasły wszystkiee światła"
hiphop,"Ciemnoo już, noc nadchodzii, głuucha"
hiphop,Z mroku wysłany płomień przetrwania odsłoni
hiphop,Wszyscy chodźcie za mną w stronę światła
hiphop,"Noc mnie obrasta, zabójcza substancja miasta"
hiphop,"Niezależny głos rasta, PCParkowy pożeracz kany"
hiphop,"Mefi any many, bez szacunku niedoceniany"
hiphop,Bajecznie nawdychani i chuj WueRE puenta
hiphop,Splifa chmura zaklęta
hiphop,"Jedna miłość, jeden człowiek Mef może Mientha"
hiphop,"Co się liczy, to się liczy co ci minie to nie zginie"
hiphop,"Kryminalne style trudne, pośród ciszy dźwięki brudne"
hiphop,"Z twoich ust same fałsze zgubne, psycha zryta"
hiphop,"Sama kana nie zyta, siemanko, łapa przybita"
hiphop,Następny dobry bandyta i WueRE dranie
hiphop,"Na głowie mam to zdanie, bestialski wzrok"
hiphop,"Dzisiaj ciemna noc, ciepła noc"
hiphop,"Miłości nie ma, mocno zaciskam pięści"
hiphop,W letnich ogrodach okryty czarną płachtą niosę złe wieści
hiphop,"Ja Mefistofeles, przyniosę twoim cierpieniom kres"
hiphop,"Nieprzespane noce, ciągły stres, życie takie piękne jest"
hiphop,Dziecino słuchaj prawdy z moich ust
hiphop,Nie chcę widzieć na twej twarzy znowu łez
hiphop,Wyrzucę wszystko co najgorsze jest
hiphop,"Zanim powiem dobrze jest, dobrze jest"
hiphop,"Ciemnoo już, zgasły wszystkiee światła"
hiphop,"Ciemnoo już, noc nadchodzii, głuucha"
hiphop,Który z was to MC Gasto który z was to Wacky D
hiphop,ja jestem Rychu Peja a wraz ze mną dziki styl
hiphop,"15 lat w grze, bywało też kalecznie"
hiphop,"ale zawsze odwiecznie, z duszą niebezpiecznie"
hiphop,"wracam po złoto, wdeptam te kurwy w błoto"
hiphop,"co z chołotą gówno plotą, ja odbiorę im godność"
hiphop,"uświadomię swą podłość, platynowy krążek dla mnie"
hiphop,"na tym bicie bezkarnie, dla hip-hopu ofiarnie"
hiphop,i wszystkich kiepskich okradnę ze złudzeń
hiphop,"bo tylko zwykły dureń nie skuma, nie zrozumie"
hiphop,leżysz pan i robisz pod siebie
hiphop,mogę nawet klepać biedę lecz nie będę pojebem
hiphop,trudno dzisiaj zdefiniować termin ko-ko-komercja
hiphop,"śmiecie bez serca, do rapu bez zacięcia"
hiphop,"niech każdy to skuma, bo nie lubię się powtarzać"
hiphop,jebać słabych MCs i massmediom się narażać
hiphop,"Ja pierdolę twój styl, ja pierdolę twój skill"
hiphop,"Ja pierdolę twój klip, ja pierdolę cię w ryj"
hiphop,"Ja pierdolę twój szmal, ja pierdolę twoje bity"
hiphop,"Ja pierdolę twoje hity, ja pierdolę takie kity"
hiphop,Rap w dobrym guście jak [?] henesi
hiphop,RDW trzy litery to nie KFC
hiphop,"z presją, bo MC nie ma lekko"
hiphop,RTV? hmm zazdrość cię zjada prędko
hiphop,ja nic tylko piszę nawet gdy nie nagrywam
hiphop,by jeździć muszę zarabiać więc dlatego pływam
hiphop,"i choć wiem, że wielu do mnie się nie umywa"
hiphop,to niestety jakiś łeb a nie ja swoją płytę wyda
hiphop,nie mam czasu i chęci użerać się o swoje
hiphop,choć nie masz szans tu ty i twoje przeboje
hiphop,"lojalność prawdomówność, kto wyjebał bobole"
hiphop,ja się nie boję więc dlatego tu stoję
hiphop,bo mam charakter i czystą kartę
hiphop,mam skillsy co zakładają wam na ryje balachy
hiphop,a ty rób lachę jak chcesz posmarkać w mikrofon
hiphop,Brahu bit z bombą Rychu z trójmiejską come on
hiphop,"RDW nie ze składanką Eski, bez kreski, bez klęski"
hiphop,"bez kiepskich, bez wiejskich melodii nawet gdy elektronicznie"
hiphop,"bez mało męskich hitów, bez chwytów pod publikę"
hiphop,ze stylem i smakiem i technicznie
hiphop,z jazdą na ten rap pies klubowo i ulicznie
hiphop,rozpierdalamy was w chuj kurwy
hiphop,nawet nie słyszę co mówicie
hiphop,"Ja pierdolę twój styl, ja pierdolę twój skill"
hiphop,"Ja pierdolę twój klip, ja pierdolę cię w ryj"
hiphop,"Ja pierdolę twój szmal, ja pierdolę twoje bity"
hiphop,"Ja pierdolę twoje hity, ja pierdolę takie kity"
hiphop,"Ej, chujowy flow, chujowy rym, chujowy styl"
hiphop,nie mogę pogodzić się z tym
hiphop,"lamusy robią syf mówiąc, że to rap"
hiphop,rozdmuchujemy was tak jak domek z kart
hiphop,"robię wdech i wydech, ty klękasz i łykasz"
hiphop,jestem jak winyl ty zapluta płyta z chodnika
hiphop,"to jest P-Ń do nas, dziwko nie licz na remis"
hiphop,wracaj tam gdzie ciągle jesteś królem remiz
hiphop,cała hip-hopowa Polska mówi P-Ń styl
hiphop,"tworzymy rap, wy robicie festyn"
hiphop,"wybacz, wybacz proszę koleżko"
hiphop,"nara Ziemowit, dobranoc Mieszko"
hiphop,wszystkim weszą wznoszę środkowy palec
hiphop,"odłóż mica, odbij, rapu nie kalecz"
hiphop,"i weź to na serio, bo wjeżdżam tu"
hiphop,"Brahu brat, Rychu Peja i RDW"
hiphop,"Ja pierdolę twój styl, ja pierdolę twój skill"
hiphop,"Ja pierdolę twój klip, ja pierdolę cię w ryj"
hiphop,"Ja pierdolę twój szmal, ja pierdolę twoje bity"
hiphop,"Ja pierdolę twoje hity, ja pierdolę takie kity"
hiphop,"Mefedron to szmata, suki nie chce znac.. JEBAĆ"
hiphop,"może z kurwą ruszę jeśli zajdzie potrzeba, a narazie to to zlewam.. JEBAĆ!"
hiphop,"Czegoś się spodziewał, że tutaj zginę?"
hiphop,Pu pu pu nie ten rocznik skurwsynie
hiphop,Farszem nabijam cukinie jesli bit byłby cukinią..
hiphop,DING DONG nie pojedziesz tą windą!
hiphop,"Zagrasz w PING PONG, to kurwa odbij, lubisz plotki, Ty mój chuj jest słodki"
hiphop,Twoje ruchy mrzonki twoje ziomki to pionki
hiphop,przeciwko nam KURWA rządowe czołgi!
hiphop,"Czujesz sie spokojny to pewnie zyjesz w bledzie,"
hiphop,"czujesz niespokojnie, to pewnie masz wyjęte.. pare nocy z rzędu"
hiphop,przegrywasz z wielodobem.. zasypiasz.. pierdolić ćpuńskie fobie! TFU
hiphop,"Jade z tym, jakbym kurwa jechal z dziwką,"
hiphop,"POLSKA, WARSZAWA CIEMNA STREFA HIP-HOP"
hiphop,macie coś przeciwko? to mamy beef na noże
hiphop,dobry boże ja pierdole co za młodzież!
hiphop,co się rap to się woże no bo co kurwa nie może?
hiphop,"Chuj mnie boli co SE napiszesz na forze, jointy smoże"
hiphop,"voila madam, Ty kurwa taka że by smyrnął po pośladach,"
hiphop,takie własnie tutaj wypierdalam a Ty w populizmach się upierdalaj
hiphop,"DZYŃ DZYŃ co tam morda u Ciebie? -EBE EBE, EBE EBE EBE"
hiphop,"I bardzo dobrze, to nie gluchy telefon, idz pokrzycz do lasu, to uslyszysz ECHO"
hiphop,ECHO satelita wysoko namierza twój telefon logowania HELLO MOTO.
hiphop,"wez ogarnij cos by nie wiedzial o tym nikt, ze sciany maja uszy"
hiphop,"wiadomo nie od dzis, sasiedzi złe intencje zawodzi czynnik ludzki,"
hiphop,tak jak bydle leci do garnka wódki
hiphop,"Potega gotowki nie chce skonczyc jak reszta, zresztą znowu wypada reszka,"
hiphop,"jebana dilerka, wrózby z bialego prochu, wybierz jedna liczbe od DZIESIECIU DO ROKU!"
hiphop,"atmosfera gęsta co raz bardziej w butli, exclusive rich bitch"
hiphop,"kupują futra z nutrii, putry kasyna hotele zabawa, jebnie ci pikawa KURWA FA zawał!"
hiphop,"la viva lambada, ladnie zes nakłamał. sad cie uniewinnia bo sam tego nie ogarnia"
hiphop,"to nie kurwa narnia, choc tysiace bajek, cuda wianki pióropusze kaszel od ruskich fajek"
hiphop,"Diri Diti meliniarsko kurwaaa dewastacyjne GRAFFITi,"
hiphop,pod kolami big city a problemy najwieksze
hiphop,"zawsze ktos do kogos ma gdzies o coś pretensje,"
hiphop,"ktos maczety miecze, ktos ma rottweilery"
hiphop,"ktos pierwsza liga samar ktoś to pierdolony steryd,"
hiphop,ktos ma dobry rap a ktos go kurwa nie ma
hiphop,SIEMA SIEMA SIEMA POZDROWIENIA Z PODZIEMIA !
hiphop,ukryta zwrotka ebe ebe 3:28
hiphop,"wpierdalam się na bit, jak prostytutki roku"
hiphop,"kurwy biorą głęboko, jak dno ma morskie oko"
hiphop,"oto, rap pierwsza liga podziemny mainstream"
hiphop,"odwrócony uśmiech, po tym napewno masz szerszy"
hiphop,"wersy, pisane późną nocą na odpale"
hiphop,"radiowozy na sygnale, w tą i we w tą krążą stale"
hiphop,"białe kitrasz w majtach, w klubach trwa rajza"
hiphop,"wixa hajda hajda, awantury jak al kaida"
hiphop,"sie wychyla łajza, jeb cep na łeb"
hiphop,"nokaut i zdechł, zszedł i come back"
hiphop,"pech bo ich trzech, odwet robią jego ziomki"
hiphop,"na szczękowej chirurgi, lekarz w całość cię łączy"
hiphop,Te rymy lecą na bit jak granat bez zawleczki
hiphop,podrapałem polskim prądem się u koleżki
hiphop,"stan mam ciężki, bliski do klęski"
hiphop,pierdolony LOS  często bywa kurewski.
hiphop,Chcesz się zemścić? Tylko na kim.
hiphop,Głos wewnętrzny mówi: Z dala od padaki
hiphop,w wykształceniu braki w uzębieniu przerwy
hiphop,"pustki w portfelu a to kurwa działa mi na nerwy,"
hiphop,"Czas jest cierpki, obraz nie wyraźny"
hiphop,jakby mnie karetką właśnie zwieźli na zakaźny
hiphop,"w koło błazny, może to oddział psychiatrii"
hiphop,lub efekt uboczny przegranej resuscytacji.
hiphop,Od atrakcji do kalectwa
hiphop,prosta ścieżka jak od ćpania do szaleństwa
hiphop,życzę szczęścia w turbulencji
hiphop,"w ustach czuję posmak, metalicznej rtęci."
hiphop,"Książki, które czytam są przygnębiające"
hiphop,ziomki nad blokami znów widzieli czarne słońce.
hiphop,"Mieć pieniądze, jeść w restauracjach trufle"
hiphop,Kurwa! Wrzątkiem zalewam chińską zupkę.
hiphop,"Kacem wódkę, krótkie zejście i w kółko"
hiphop,wszystko do kurwy nędzy przełożę na jutro
hiphop,DCDT od D do D do L
hiphop,Dla dziwek lubrykant nie dla lamusów żel.
hiphop,"Właśnie tak kurwa, myślałeś że inaczej?"
hiphop,"To byłeś w błędzie, elo"
hiphop,"Każdy obiera cele, poruszam się we mgle"
hiphop,w razie zagrożenia być silnym jak lew
hiphop,"niech, się dzieje co nieuniknione"
hiphop,wszystkie skróty ulic tego miasta przestrzelone.
hiphop,Milczy abonent bo odpierdala w PACE
hiphop,gdy mandat łamiesz blatem myślisz wyżej jest inaczej
hiphop,"no chyba nie raczej, zbyt potężny lobby (chyba)"
hiphop,By dojść do prawdy tego świata
hiphop,Po śmietnikach nurki poszukują szamy
hiphop,i czy komuś pomożemy tym że to udostępniamy?
hiphop,Człowiek jest cwany najbardziej wobec siebie
hiphop,nie wiesz? czy nie chcesz o tym wiedzieć.
hiphop,Co mam ci powiedzieć? O czym napisać
hiphop,każdy za pieniądze będzie patrzył jak zdychasz
hiphop,"brzytwy się chwytasz, oburącz"
hiphop,widzę jak apteki symbol oplata wąż
hiphop,Farmakologia w tym przypadku nie działa
hiphop,którędy trzeba pójść by amfę wpierdolić w kanał
hiphop,Pamiętasz wtedy na centralnym dworcu te trupy?
hiphop,Na mordach miały strupy za ćwiary dały by dupy
hiphop,Rap dla cztery łapy KUTY  JOŁ
hiphop,Zawsze po bicie chciałem jechać jak czołg
hiphop,"nie ćwok, kurwo puk puk"
hiphop,czujesz jak kastet rozpierdala ci brwiowy łuk.
hiphop,"Ta, ktoś ci jebnie i leżysz kurwo"
hiphop,"cię nie ma, na wieki wieków amen"
hiphop,"wszystko przejebane kurwa, jebać."
hiphop,"Spójrz na nagłówki gazet, potrafisz się cieszyć?"
hiphop,"Z życia, zobacz ile warty jest twój sprzeciw"
hiphop,media co chwilę donoszą o śmierci
hiphop,zdajesz sobię sprawę że stąpasz obok tragedii?
hiphop,Politycy pierdolą jak najęci
hiphop,wciąż te same mordy wyświetlane w pętli
hiphop,"aż mnie mdli, na samą myśl"
hiphop,że do władzy w Polsce znowu dochodzi (pis)
hiphop,Na rząd PiS to jest nieodwracalne
hiphop,"pokaż kraj, w którym prawo karne jest moralne"
hiphop,władze niesprzedajne tu zmiany diametralne
hiphop,"na lepsze nie realne, co jak (??) ma brutalne"
hiphop,Dobro i zło jest nierozszczepialne
hiphop,zabijanie bydła ponoć humanitarne.
hiphop,Czujesz? Liczysz na jakiś łut szczęścia
hiphop,PRZEŻUWAJĄC  kawałek martwego zwierzęcia
hiphop,"Reklama cię nakręca, dobra fura fajna szmula"
hiphop,"dobra praca, zimna wóda, jak tabloid toniesz w brudach"
hiphop,Łapiesz? Życie jest jak zdrapka
hiphop,"drapiesz drapiesz chuj wydrapiesz, kurwa i po jabłkach"
hiphop,"każdy ruch pułapka, szczur w labiryncie"
hiphop,"życie, stąd bez śmierci nie wyjdziesz"
hiphop,"na torcie wiśnie, w oryginałach rapowe wersy."
hiphop,Uliczny przekaz dla mnie zawsze najszczerszy!
hiphop,"Ty idziesz do roboty, ja piszę te wersy"
hiphop,"Nic nas nie łączy, choć Ciebie coś śmierdzi"
hiphop,Możesz to wylać sobie w komenty
hiphop,I tak nie będę tym nigdy dotknięty
hiphop,Ciągną się za mną życiowe błędy
hiphop,"Zawieszone wyroki, dragi, ruletki"
hiphop,"Wąskie mam plecy, więc zbieram sprzęty"
hiphop,Z nimi się czuję tu bardziej bezpieczny
hiphop,"Telefony są unconnecting, odkąd poleciał rejestr prepaid"
hiphop,"W robieniu ludziom pod górę, można by mówić, że całkiem w cipę"
hiphop,"Ty, kiedy mówisz, to palisz, czy żalisz"
hiphop,I co to kurwa tu wnosi do sprawy
hiphop,Z domu Cię powlekł dzielnicowy
hiphop,Gdzie Ty widziałeś te swoje obławy?
hiphop,Więc co Ty wiesz o paraliżach
hiphop,Co Ty wiesz o barykadach
hiphop,Prawdziwy Polak walczy do końca
hiphop,"Bagar podważał, zastęp straży"
hiphop,"Bania paruje, popcorn bym prażył"
hiphop,"Na czole, gdybym go miał ze sobą"
hiphop,"Ale ten bit nie jest cukinią, ding-dong"
hiphop,A baniak patelnią
hiphop,"Poleci to w karną, nie w cywilną"
hiphop,"Z tym, że zawias jest ostro nagięty"
hiphop,I oby papuga w zoologicznym znalazła przestrzeń na manewry
hiphop,"Zakończy bez przerwy, hajsy go w plecy"
hiphop,Ale kurwa bez jebanych klatek
hiphop,Tutaj nawet najlepszy driver może wpierdolić się na wypadek
hiphop,Ubezpiecz rodzinę od złego
hiphop,"W imię ojca, i syna, i ducha świętego"
hiphop,Wszystko się może tu złożyć jak Lego
hiphop,Albo kurwa rozjebać jak pedał
hiphop,"W mordę jebany, bezczelnie rap sprzedał"
hiphop,Za to więc tutaj siejemy terror
hiphop,"Kurwa, masz przejebane, ta"
hiphop,Podaję rękę koleżkom jak mogę
hiphop,Bo sam nieraz tutaj gubiłem drogę
hiphop,A wiesz co jest w tym wszystkim najlepsze?
hiphop,Zobaczysz wtedy kto będzie przy Tobie
hiphop,"Rap na hardkorze, [?]"
hiphop,Zawsze pierwszy do prawilnej gadki
hiphop,Zjeżdżam kurwa na sanki
hiphop,Zgadnij kto do dziś mi leży
hiphop,"Te wersy jak pnączę, flow kwadratowe"
hiphop,Bit zapewniony na repeat
hiphop,"Na forach piszą, że nie trafiam w bit"
hiphop,"No widzisz, no widzisz, no widzisz, a widzisz"
hiphop,"Lecę sobie na pojedynczych, i szczerze pierdolę Twoją technikę"
hiphop,"Myślę, że pierdoli głupoty, kiedy Ci mówi, że się rozmiar nie liczy"
hiphop,"Twoje życie, Twój wybór, tłumacz sobie to tak, jak chcesz"
hiphop,"Godziny, nie minuty, flow, ale co Ty kurwa o tym wiesz"
hiphop,"Kolejny sztos biorę od NWS, i słychać od razu, za co płacę mu cash"
hiphop,"Ty zmień producenta, to nie 95, tylko 666"
hiphop,"Zmień dilera, NWO, tu 1 równa się 07"
hiphop,"Może to jej urok, może to Maybay, może kurwa mać sam już nie wiesz"
hiphop,"Get the kurwa London look, to na bani wjeżdża jak but, łup"
hiphop,"Wymień sobie zamki w drzwiach, kiedy szmatom rozdałeś klucz"
hiphop,"Nie pytam czemu, nie pytam skąd"
hiphop,"To samo się skleja, rap płynie we krwi"
hiphop,"Rym za rymem, jak stroboskop, zapierdala od epilepsji"
hiphop,"Jesteś o krok, kiedy podchodzisz do mnie na wyciągnięcie ręki"
hiphop,"Z tym, że nie pierdolim selfie, bo nie o tym te wersje"
hiphop,"Poza mym gronem rzadko tankuję, bo popelina tu może być w chuj"
hiphop,"Ty się z kolegą współwalasz z obcymi, kiedy wam pękną litr na dwóch"
hiphop,"Wszystko wycierpuch, Ty jak bordziuch"
hiphop,"Tipa oszczędzisz, ale płyniesz na dzwonku"
hiphop,"No kurwa enigma na Twoje nieszczęście, kierowca znajomy sprzedaje nam dowcip"
hiphop,"Porzucam furę w centrum, jutro odbiorę, dziś wracam numberem"
hiphop,"Robiłem paznokieć z Olem, Majorem, Kaziorem i z Lublina bokserem"
hiphop,"Trochę się spięłem, bo był to trzeci dzień mojej pierwszej doby"
hiphop,"Szczecin nigdy nie leżał nad morzem, a była to noc długich węgorzy"
hiphop,"Życie, życie jest nowelą, której nigdy nie masz dosyć"
hiphop,"Wczoraj biały, biały welon, jutro białe, białe nosy"
hiphop,"Otwieram oczy, telefon mryga, sprawdzam, nieodebrane połączenia"
hiphop,"Skarbie, you are so special, jednak przegrywasz z trybem wyciszenia"
hiphop,"I tak związku nie szukam, tylko party hard and dirty dancing"
hiphop,"Pany z selekcji robią zwrot do taksówki, warszawskie kluby są expensive"
hiphop,"2017, mistrzowie stylizacji, kurwa te rapy jak szkodnik"
hiphop,"Czuję N O C w powietrzu, jak szósty zmysł, jak patoprzewodnik"
hiphop,"Brudny chodnik, postawią mi pomnik, na koncie komornik blokuje przelew"
hiphop,"To się chyba kurwa nigdy nie skończy, w bankach już nawet nie pytam o debet"
hiphop,"Vixa forever, HardkorKrokodajl, Mortal Kombat, Brutality"
hiphop,"Fatality, wersy jak nity, polecą szyby, będziesz pobity"
hiphop,"Cipy, cipy, cipy, tu nie ma dziewic, odpalam Tinder"
hiphop,"Mentos the freshmaker, tej zimnej nocy znajdę ciepłą pizdę"
hiphop,"Jak zawsze ambitnie, Warsaw, miasto skrajności, jebanych kontrastów"
hiphop,"W niebezpieczeństwie, w labiryncie, lej na drugą nogę, w jebanym potrzasku"
hiphop,"W nałogu, w treningu, wszystko jest zmienne, który to raz już się podnosisz?"
hiphop,"Nic Ci tu nie da krem pod oczy, z daleka widzę Twe ptasie oczy"
hiphop,"Mówię Ci mordo, kurwa źle skończysz, umoczysz, się tym pogrążysz"
hiphop,"Hasło jest błędne, Twój ziomek na skręcie, zrywam to łącze"
hiphop,[Zwrotka 1]
hiphop,"To warszawski walczyk, kurwo chodź zatańczysz"
hiphop,Zapięta będziesz kurwa na cylinder cwancyś
hiphop,Wyskocz do tych punchy (eee eee)
hiphop,"Zruchają Cię te wersy, to fakt bezpretensjonalny"
hiphop,"Cisnę jak sok z pomarańczy, ze mną moje bratki"
hiphop,"Kurwa bez przypadku, bez frajerskich akcji"
hiphop,Ty nagrywasz na tel gadki? Screenshoty robisz z czatu?
hiphop,Filmujesz mnie z przyczajki? No mało psychopatów?
hiphop,Zbierasz na mnie haki? Puścisz to w Glamrapy?
hiphop,I kto komu bardziej teraz robi tu reklamy?
hiphop,"Popkillery podłapują, widać poziom #Pudelek"
hiphop,Rogal zjechał psychiatryk
hiphop,"This is prank bro, this is prank bro"
hiphop,"Jak wy kurwa chcecie zabijać pop, jak wasz poziom to niżej niż dno?"
hiphop,Już nie mowie nawet o tych Glamrapach
hiphop,"Bo naprawdę, co trzeba mieć w głowie, żeby kurwa to czytać?"
hiphop,"Jebać, z resztą czekajcie sobie na nowe newsy"
hiphop,"Ale rapu na bank nie rozkminisz, bo jesteś na to za głupi"
hiphop,"Za głupi, za głupi, za głupi"
hiphop,Za te plotkarskie kurwa chuj wam do dupy
hiphop,"Ta, daj mi kurwa teraz trochę szybciej to"
hiphop,"Się wkurwiłem, e"
hiphop,"Raz, raz, raz"
hiphop,"Raz, dwa, raz, dwa, raz, dwa, raz, dwa"
hiphop,Pantha Rei kurwo wszystkich nas prędzej
hiphop,Kurwa czy później tu zapierdoli piach
hiphop,"Słyszysz sekundnik, to Twój czas spierdala"
hiphop,"Odwracasz głowę, pach"
hiphop,[Zwrotka 2]
hiphop,"Ave maria, ave satana"
hiphop,"Dualizm duszy, krew spływa po ścianach"
hiphop,Wychodzę na balkon i niebo jest czarne
hiphop,"I słońce jest czarne, kurwa nie mam nic w planach"
hiphop,"Wracam na kwadrat, ona jest martwa"
hiphop,Nie mam pojęcia kim kurwa jest
hiphop,Podchodzę powoli i cała jest w folii
