hiphop,"Bez obiecanek, wolisz dotyk, więc przystanek"
hiphop,Fokusmok - dla fanek
hiphop,nie jeden się tu głowi
hiphop,Jak to się robi?
hiphop,No a robi się to tak..
hiphop,na to zawsze gotowi
hiphop,nie jeden się tu głowi
hiphop,Jak to się robi?
hiphop,No a robi się to tak..
hiphop,na to zawsze gotowi
hiphop,"Chcesz wiedzieć, jak to się robi? Lekcja numer jeden:"
hiphop,"Traktuj je jak powietrze, nie odpędzisz ich od siebie"
hiphop,"Nie jesteś frajerem, nie stawiaj drogich alkoholi"
hiphop,Niech dziurze nie uderzy woda sodowa do głowy
hiphop,"Pokaż klasę damie, nie gardź przy niej szmatą"
hiphop,"Cipka polityką, ty od teraz dyplomatą"
hiphop,"Będzie warto, nawiń na uszy makaron"
hiphop,Sypnij 3 komplementy nogi się rozkładają
hiphop,"Jest piękna, mądra, podąża tropem mody"
hiphop,"Złamane kody, masz lody lody lody,"
hiphop,"Żywe dowody, że te lekcje są bezcenne"
hiphop,Najlepsi stratedzy jak krew przelewają
hiphop,S do P do E do R do M do Ę
hiphop,"Chcesz tego czy nie? Full kontakt, ostrą grę?"
hiphop,"Seks jak sport, szybką piłkę, mokry kort"
hiphop,"Wiesz jak to się robi, kiedy już zdobyty fort"
hiphop,no nie jeden się tu głowi
hiphop,Jak to się robi?
hiphop,a robi się to tak..
hiphop,na to zawsze gotowi
hiphop,no nie jeden się tu głowi
hiphop,Jak to się robi?
hiphop,a robi się to tak..
hiphop,na to zawsze gotowi
hiphop,"Panowie, lokal otwarty, oto wrota na party"
hiphop,"Na to zawsze gotowi, no to w szeregu zwartym"
hiphop,"Do baru, po bronki w kolejce ludzi paru"
hiphop,Obrót 3 6 0 dziś trzeba użyć czarów
hiphop,Wampa mijam
hiphop,"ach jakbym ją tak z kija,"
hiphop,gładziutka szyja i ja haps kły jej wbijam
hiphop,"zerkam po ryjach, podejrzewam, że niczyja"
hiphop,"atmosfera sprzyja, więc podbijam i nawijam"
hiphop,"nudę zabijam, nie zaziewasz nawet, ponieważ ściemy omijam"
hiphop,dlatego tego nie lekceważ
hiphop,"w mordę jeża, piękna, ponętna nie dowierzam"
hiphop,"inteligentna, to we mnie uderza"
hiphop,na parkiecie kobiecie dirty dancing pokażę
hiphop,I jak Pershing tam w parze w podnietę ją wyposażę
hiphop,"a że zmoknie okropnie, gdy seksownymi ruchami porażę"
hiphop,wraz z rytmem w parze się na harce odważę
hiphop,"w kotka, myszkę zagramy"
hiphop,gdy w ustronne miejsce się udamy
hiphop,zmysły postradamy i emocjom oddamy
hiphop,"chyba, że rady nie damy,"
hiphop,"popadamy, skończy się gra"
hiphop,"co się odwlecze, nigdy nie uciecze, nie.."
hiphop,toć i pa ! R + A + H
hiphop,"strach pomyśleć, że Rah się tak leni"
hiphop,"strach pomyśleć, że Mag się tak leni"
hiphop,"strach pomyśleć, że Fo się tak leni"
hiphop,"strach pomyśleć, że Squad się tak leni"
hiphop,"wszyscy śnią, wszyscy smacznie śpią"
hiphop,Rah ręka posuwa myszkę z Fo
hiphop,Trzy kawy wy-pi-te
hiphop,Słuchawy w łeb wbi-te
hiphop,I w dodatku cechą tą trafiony w spadku
hiphop,"Dawno po północy, ja mam to w zadku"
hiphop,Zatopiony w dźwięków dostatku
hiphop,"Do sił ostatku, z bety upadku"
hiphop,"Tik-tak, dzwonek, budzik, luzik"
hiphop,"Wstaje, co mi pozostaje?"
hiphop,"Iść za zwyczajem. (Smacznego, brat)"
hiphop,"Dzięki, nawzajem"
hiphop,Zaraz się najem i na misję się udaję
hiphop,"W usta faję, Rah, mach w płuco daję"
hiphop,Noga po nodze na drodze staje
hiphop,"I pędem do biura, a tam pełna kultura"
hiphop,"Pod ręką komóra, na parkingu fura"
hiphop,Dyrektywy od Chief’a
hiphop,"Nura w kangura, po hurtowniach tura,"
hiphop,W końcu godzina która
hiphop,"Pozwala na to, by pójść do domu, no to rura"
hiphop,"Tam obowiązki, nie cierpię ich, są jak tortura"
hiphop,"Stała procedura, mamo, nie mam czasu dziś akurat"
hiphop,Bo w pokoju .... przegrzewa się aparatura
hiphop,Dla ciebie to robię .. uświadom to sobie
hiphop,Na lenia w chorobie.. wiem jak dogodzić tobie..
hiphop,Od początku muszę tego słuchać?
hiphop,"Ta, musisz."
hiphop,"Dobra, niech tak będzie..."
hiphop,Muszę tego słuchać.
hiphop,Ja tego muszę słuchać!
hiphop,"Gdybam, gdyby to nie było na niby"
hiphop,"Gdybam , gdyby to nie było na niby"
hiphop,"Gdyby, gdyby to nie było na niby"
hiphop,Gdyby świat cały
hiphop,Obrósł w niebieskie migdały
hiphop,Gdyby Magik był doskonały
hiphop,Gdyby podziały gdzieś się podziały
hiphop,Gdyby ryby głos też miały
hiphop,Kaktusy na dłoniach by wyrastały
hiphop,Gdyby po Ziemi stąpały ideały
hiphop,Biały byłby czarny
hiphop,A czarny biały
hiphop,Indywidualnie na życzenie upały
hiphop,Wciąż smakowały te same specjały
hiphop,Minerały każdej skały
hiphop,Szlachetne jak kryształy
hiphop,A wszystkie kabały
hiphop,To tylko kawały
hiphop,Gdyby czyn był godny chwały
hiphop,Gdyby Fokus nie był tak zarozumiały
hiphop,Gdyby wrony nie krakały
hiphop,Gdyby kozy nie skakały
hiphop,Gdyby tak psy nie gryzły
hiphop,Koty nie drapały
hiphop,A komary nie wkurwiały
hiphop,Gdyby dyskojeby tak się nie rzucały
hiphop,Gdyby równiejsze z równymi równać chciały
hiphop,Gdyby nowe hip- hopowe kluby powstawały
hiphop,Gdyby foki w klubach tych dupami wywijały
hiphop,A ekipy rymowały
hiphop,A się nie napierdalały
hiphop,Gdyby składy tak jak mówią reprezentowały
hiphop,Gdyby z pióra słowa dosłowne spływały
hiphop,Gdyby w Gie O Pe zwykłe deszcze padały
hiphop,Gdyby szyby i kominy mnie nie otaczały
hiphop,A kraina Niby-Niby
hiphop,Gdyby kromki spadały odwrotnie
hiphop,Gdyby przerzutnie pociągały mnie okropnie
hiphop,Gdyby rymy się składały wielokrotnie
hiphop,Gdyby hip- hopowe głowy dostawały stopnie
hiphop,A stopnie wystawiane by nie były pochopnie
hiphop,Gdyby u mnie na oknie stały
hiphop,Kwiaty paproci i niebieskie migdały
hiphop,Gdyby ich cechy się uzupełniały
hiphop,Gdyby cudowne sny się sprawdzały
hiphop,Gdyby Rahim zbierał pochwały
hiphop,Gdyby problemy zmieniały się w banały
hiphop,Gdyby z wszystkich treści morały wypływały
hiphop,Gdyby partnerki partnerów swych kochały
hiphop,Gdyby oczy nie płakały
hiphop,A usta się wciąż śmiały
hiphop,Gdyby powracały piękne chwile
hiphop,Gdyby lepsze czasy nastały
hiphop,Gdyby kawki nie padały
hiphop,Gdyby pały nie ścigały
hiphop,Gdyby składy hip- hop grały
hiphop,Przy tym nie dawały chały
hiphop,Gdyby gazy nie wybuchały
hiphop,A pożary nie wyniszczały
hiphop,Gdyby wody nie zalewały
hiphop,Kataklizmy nie istniały
hiphop,Gdyby bratnie dusze się wspierały
hiphop,I sobie ufały
hiphop,Gdyby rymy tylko na wolno powstawały
hiphop,Gdyby farby nie zaciekały
hiphop,I na murze nie matowiały
hiphop,Gdyby wielkie nominały
hiphop,Każdą kieszeń oblężały
hiphop,Na plakatach by widniały
hiphop,Pfk inicjały
hiphop,No a konfesjonały
hiphop,By innowierców pochłaniały
hiphop,Gdyby wszelkie bariery pozanikały
hiphop,Gdyby żadne serduszka nie pękały
hiphop,Gdyby kary winnych spotykały
hiphop,Gdyby każdy był wyrozumiały
hiphop,(No to zaśpiewajmy coś wesołego)
hiphop,"Przeważnie, (przeważnie) zachowuję się poważnie"
hiphop,"Przeważnie, (przeważnie) nikogo nie drażnię"
hiphop,"Przeważnie, (przeważnie) słucham rad uważnie"
hiphop,"Przeważnie, (przeważnie) nie czuję się odważnie"
hiphop,"Przeważnie, widać to po mnie wyraźnie"
hiphop,Otoczenie nie działa na mnie zakaźnie
hiphop,Poprzez wyobraźnię kreuję własne ja
hiphop,Adekwatne do imienia
hiphop,eR plus A plus Ha
hiphop,Robię co trza
hiphop,Rymuję gdy muzyka gra
hiphop,Jestem członkiem Pfk
hiphop,A nie klubu AA
hiphop,Pomysłów we mnie mnóstwo
hiphop,Niczym w worku bez dna
hiphop,Bądź co bądź być sobą to domena ma
hiphop,Pokazy mody i żurnale nie obchodzą mnie wcale
hiphop,Fason swój dobieram sam jak staruszka korale
hiphop,Mam typ osobisty niczym dowód
hiphop,I osobisty powód
hiphop,"By czuć się wygodnie, swobodnie"
hiphop,Polski rodowód w aktach
hiphop,Opieram się tylko i wyłącznie na faktach
hiphop,"Pragnę być nietypowy, niepowtarzalny"
hiphop,Jednorazowy i oryginalny
hiphop,Jeśli kopiuję to tylko w punktach ksero
hiphop,Gdy ktoś powiela kogoś
hiphop,Uważam go za zero
hiphop,Mówię prawdę szczerą
hiphop,Bo nie lubię gdy ktoś kłamie
hiphop,"Służę pomocą, nie na każde zawołanie"
hiphop,Mam własne zdanie i szereg racji
hiphop,"Niezmienny niezależnie od miejsca, czasu i akcji"
hiphop,"Od A do Zet, od Zet do A"
hiphop,Ja to ja to jasne jak dwa razy dwa
hiphop,"Lata lecą, a ja to wciąż ja i ja"
hiphop,O nie! Nie zależy mi na tym by być kanonizowanym
hiphop,"Ja to ja, więc jako ja chcę być znany"
hiphop,"Prawdziwym jak prawdziwek, nie jak sweter z anilany"
hiphop,Jedną zasadą wciąż motywowany
hiphop,Bądź własną osobą
hiphop,Bądź co bądź sobą
hiphop,Niech twa osoba będzie ozdobą
hiphop,"Nie jednorazowo, lecz całodobowo"
hiphop,Trafiam białym w czarne jak kulą bilardową
hiphop,Oblicz pole podstawy jaką jest oryginał
hiphop,"Lub działania poletko, jeśli jesteś marionetką"
hiphop,"To wroga sugestia, pożera cię jak bestia"
hiphop,"Mów do serca bitu, bo tam jest amnestia"
hiphop,"Od A do Zet, od Zet do A"
hiphop,Ja to ja to jasne jak dwa razy dwa
hiphop,"Proste jak drut, nigdy nie gram z nut"
hiphop,"A rymów mam w brud, które trwonię"
hiphop,Gdy tylko stanę przy mikrofonie
hiphop,"Od mikrofonu strony nie stronię, o nie!"
hiphop,"Od A do Zet, od Zet do A"
hiphop,Ja to ja to jasne jak dwa razy dwa
hiphop,Lata lecą a ja to wciąż ja
hiphop,"Od A do Zet, od Zet do A"
hiphop,Ja to ja to jasne jak dwa razy dwa
hiphop,Paktofonikę Gutek już zna
hiphop,Technika Fokusonika wynika
hiphop,Z ego wielkiego jak galaktyka
hiphop,Nie brakuje mi żadnego składnika
hiphop,"Do mojego ja, skala mnie nie dotyka"
hiphop,"Pozwolisz, że posłużę się przykładem"
hiphop,"Jest pewien Smok, który nie jest gadem"
hiphop,"Podąża śladem serca, a nie za stadem"
hiphop,Jego skronie ozdabia tkany wolnością diadem
hiphop,Jego słowa są szczęścia wodospadem
hiphop,Tą oto wodą razem ze składem
hiphop,Zalewa jak ulewa lub zasypuje gradem
hiphop,Chcesz czy nie jesteś dla niego obiadem
hiphop,"Robię to co kocham, to nikomu nie szkodzi"
hiphop,Robię to no bo to lubię i wiem że wiesz o co mi chodzi
hiphop,Robię to no bo chcę to robić a wiem że to mi wychodzi
hiphop,"Chcę i robię, cała reszta mnie nie obchodzi"
hiphop,"Od A do Zet, od Zet do A"
hiphop,Ja to ja to jasne jak dwa razy dwa
hiphop,Lata lecą a ja to wciąż ja
hiphop,Unikam odgrywania kiedy reggae prezentuje
hiphop,W jednym więc celu bądź co bądź operuje
hiphop,"A skutek, wierz - Peace, pozytywny flow"
hiphop,podpisano Gutek
hiphop,"Od A do Zet, od Zet do A"
hiphop,Ja to ja to jasne jak dwa razy dwa
hiphop,Lata lecą a ja to wciąż ja
hiphop,"Od A do Zet, od Zet do A"
hiphop,Ja to ja to jasne jak dwa razy dwa
hiphop,Paktofonikę Gutek już zna
hiphop,Marzę o tym żeby móc na widok policjanta
hiphop,"Odetchnąć z ulgą i pomyśleć, że jestem bezpieczny"
hiphop,997 ten numer to kłopoty
hiphop,Gdy wydarzy się incydent to pojawia się konfident
hiphop,Dzwoni 997 i wszystkich sprzedaje
hiphop,"Przyjeżdżają kurwy, menty, jebane suki"
hiphop,"Śmiecie, psy, pierdolone kupy gówna"
hiphop,"Wygarnąć do nich z gana, to moje marzenie"
hiphop,"Pierdole konsekwencje, areszty i więzienie"
hiphop,Jak siedzieć to kurwa za coś konkretnego
hiphop,"Sprzątnęłeś psa, nie pierdolisz się kolego"
hiphop,"Lądujesz w areszcie, masz ich wszystkich w dupie"
hiphop,Pierdolimy policję i trzymamy się w kupie
hiphop,"To jest nasza siła, potęga, moc i chwała"
hiphop,Każdy ze Slums Attack nienawiścią do nich pała
hiphop,Kurwa w mundurze to nasz największy wróg
hiphop,Nienawidzę ich jak mogę i pluję im w mordę
hiphop,"Ściągają cię z ulicy, oskarżają o zbrodnie"
hiphop,"Popychają cię pod ścianę, obszukuję kurtkę, spodnie"
hiphop,"Słuchasz ich uważnie, wysłuchujesz te plugastwa"
hiphop,Każdy taki pies to jebany pederasta
hiphop,"Policja, policja nam dokucza"
hiphop,Bo policja to skurwiele i jebane pedały
hiphop,Nigdzie się nie ruszą kurwa bez policyjnej pały
hiphop,"Uwielbiają napierdalać, poniżać, torturować"
hiphop,"Nigdzie przed tym gównem, ścierwem nie możesz się schować"
hiphop,Nadużycie władzy i poczucie siły
hiphop,Czy nikt nie powstrzyma tej policyjnej kiły
hiphop,"Policja, policja nam dokucza"
hiphop,Być stróżem prawa to jest pomysł durny
hiphop,Pierdolmy wszyscy razem policyjne kurwy
hiphop,Być stróżem prawa to jest pomysł durny
hiphop,Pierdolmy wszyscy razem policyjne kurwy
hiphop,Być stróżem prawa to jest pomysł durny
hiphop,Pierdolmy wszyscy razem policyjne kurwy
hiphop,Być stróżem prawa to jest pomysł durny
hiphop,Pierdolmy wszyscy razem policyjne kurwy
hiphop,Być stróżem prawa to jest pomysł durny
hiphop,Pierdolmy wszyscy razem policyjne kurwy
hiphop,"Policja, policja nam dokucza"
hiphop,Jak się od nas nie odczepią zaczniemy ich zabijać
hiphop,"Myślą sobie kurwy, my wszystko możemy"
hiphop,Jak ci coś nie pasi to cię zaraz obijemy
hiphop,Dostajesz po ryju i bardzo cię boli
hiphop,Lecz trzeba być twardym i nie można się pierdolić
hiphop,"Gdy policja, to kurestwo nadużywa swych praw"
hiphop,"Nie można stać bezczynnie, nie można się też bać"
hiphop,Stróże porządku i praworządności
hiphop,Od ich poświęcenia bolą kurwa tylko kości
hiphop,"Napierdalać oni lubią, pałka to ich atut"
hiphop,"Odpowiedzą za to kurwy, odpowiedzą za to"
hiphop,Dlaczego ja? dlaczego ty?
hiphop,Za co nas biją jebane kurwa psy
hiphop,Czy jestem złym człowiekiem? czy nie mogę nic powiedzieć?
hiphop,"Mam to tolerować nic nie mówić, cicho siedzieć?"
hiphop,"Zastraszyć się nie dam, nie dla mnie jest milczenie"
hiphop,"Jest to zwykła zgraja kurew, im należy się więzienie"
hiphop,Niczym się nie różnią od zwykłego złoczyńcy
hiphop,"Chyba tylko zasadami, bo bandyci mają honor"
hiphop,I swój pieprzony styl
hiphop,"Już mam dość tych gliniarzy, już mam dość tych gliniarzy"
hiphop,"A dziewczyny w mundurach, to gówno ci dołoży"
hiphop,"Więc uważaj na nich bardzo, bo będzie jeszcze gorzej"
hiphop,"Bo to jedna wielka banda, są panami twego miasta"
hiphop,"W starciach z policją, ucierpi twoja kasta"
hiphop,Bo do twego życia nie wnoszą nic nowego
hiphop,"Chyba, że masz ochotę na sińce kolego"
hiphop,"Policja, policja nam dokucza"
hiphop,Jak się od nas nie odczepią zaczniemy ich zabijać
hiphop,Być stróżem prawa to jest pomysł durny
hiphop,Pierdolmy wszyscy razem policyjne kurwy
hiphop,Być stróżem prawa to jest pomysł durny
hiphop,Pierdolmy wszyscy razem policyjne kurwy
hiphop,Być stróżem prawa to jest pomysł durny
hiphop,Pierdolmy wszyscy razem policyjne kurwy
hiphop,Być stróżem prawa to jest pomysł durny
hiphop,Pierdolmy wszyscy razem policyjne kurwy
hiphop,Być stróżem prawa to jest pomysł durny
hiphop,Pierdolmy wszyscy razem policyjne kurwy
hiphop,"Policja, policja nam dokucza"
hiphop,Jak się od nas nie odczepią zaczniemy ich zabijać
hiphop,"Aresztowanie jest dramatem, więc opuszczasz swoją chatę"
hiphop,"Pociągasz za spust, widzisz rozjebany mózg"
hiphop,"To twoja decyzja, ten wybór jest twój"
hiphop,"Zabijasz gliniarzy, robisz naprawdę niezły gnój"
hiphop,Kryminał jest miejscem do którego nas zapędzają
hiphop,"Pieprzę skurwieli, niech w kiciu sami zdychają"
hiphop,"Twój ziomek, towarzysz, kumpel z podwórka"
hiphop,"Chciał więcej od życia, lecz zapomniał, że dwururka"
hiphop,Jest w jego rękach przedmiotem niebezpiecznym
hiphop,"Wyjebał z niej dwa razy, powtórzył to ponownie"
hiphop,"Gliniarz się wypróżnił, kurwa zasrał całe spodnie"
hiphop,"Nie było co zbierać, pierdolona afera"
hiphop,"Policja, policja nam dokucza"
hiphop,"Jeśli chcesz uzyskać pomoc, jeśli czujesz się gorzej"
hiphop,"Ja mówię ci człowieku, pies ci w niczym nie pomoże"
hiphop,"Czujesz zagrożenie, potrzebujesz ochrony"
hiphop,Kup sobie dziewiątkę i naciągnij zasłony
hiphop,Posiedź trochę w chacie i czasem do nich nie dzwoń
hiphop,"Oni nie są ci potrzebni, to twoje interesy"
hiphop,Próbują oskarżyć często ludzi niewinnych
hiphop,Zwalają winę nie pytając o przyczynę
hiphop,"Mają wszystko w dupie, byle zaszumieć"
hiphop,Każdy glina tylko w łapę brać umie
hiphop,"Opłacają drogie kurwy, wynajmują limuzyny"
hiphop,To za nasze pieniądze bawią się te skurwysyny
hiphop,"Policja, policja nam dokucza"
hiphop,Jak się od nas nie odczepią zaczniemy ich zabijać
hiphop,Zamiast pomagać ludziom w potrzebie
hiphop,Wolą zbijać kasę i czekać aż wymięknę
hiphop,"Lecz ja nie puszczam farby, wcale nie mam zamiaru"
hiphop,Nigdy się nie przyznam nie przypucuję do towaru
hiphop,"Gówno na mnie macie, gówno o mnie wiecie"
hiphop,"Sami przecież ćpacie, sami przecież handlujecie"
hiphop,Jesteście wpływowi ustalacie własne prawa
hiphop,Porządek publiczny to przecież wasza sprawa
hiphop,Was interesuje jak by dorwać się do kasy
hiphop,Chcecie zabrać jak najwięcej od szarej ludzkiej masy
hiphop,Złodziejstwo i chciwość zakodowane macie w genach
hiphop,"Korupcja, korupcja nic się kurwa nie zmienia"
hiphop,Wasza instytucja to choroba weneryczna
hiphop,"Powstaje nagle, niebezpieczna, spontaniczna"
hiphop,"Epidemia nam zagraża, jestem tego świadomy"
hiphop,Więc trzeba wam płacić bo inaczej namierzony
hiphop,"Uziemicie mnie, czeka mnie więzienie"
hiphop,"Chyba, że zapłacę bo wy macie swoją cenę"
hiphop,"Potraficie być mili, uprzejmi, ułożeni"
hiphop,Jak tylko dostaniecie mały zwitek do kieszeni
hiphop,"Wtedy wszystko gra, świat się staje kolorowy"
hiphop,Władza za pieniądze jak towar w monopolowym
hiphop,"Bo nie ma z nich pożytku, ale trzeba ich opłacać"
hiphop,Bo wiedzą gdzie uderzyć jak po dupie cię pomacać
hiphop,"Mają swoje wtyki, szeregi konfidentów"
hiphop,"Taki wywiad na dzielnicy, siatka tajnych agentów"
hiphop,Założysz z nimi spółę albo puszczą cię z torbami
hiphop,Wszystkim dysponują z pieprzonymi rejestrami
hiphop,A jeśli któryś z nich jeszcze raz się przypierdoli
hiphop,"Obiecuję kurwa wszystkim, że pozabijam gnoi"
hiphop,...że pozabijam gnoi...
hiphop,...że pozabijam gnoi...
hiphop,...że pozabijam gnoi...
hiphop,...że pozabijam gnoi...
hiphop,Marzę o tym żeby móc na widok policjanta
hiphop,Odetchnąć z ulgą i pomyśleć że jestem bezpieczny
hiphop,...że pozabijam gnoi...
hiphop,...że pozabijam gnoi...
hiphop,...że pozabijam gnoi...
hiphop,...że pozabijam gnoi...
hiphop,Marzę o tym żeby móc na widok policjanta
hiphop,Odetchnąć z ulgą i pomyśleć że jestem bezpieczny
hiphop,Że pozabijam gnoi
hiphop,Że pozabijam gnoi
hiphop,Że pozabijam gnoi
hiphop,Marzę o tym żeby móc na widok policjanta
hiphop,Odetchnąć z ulgą i pomyśleć że jestem bezpieczny
hiphop,"Nikt ode mnie nie wymaga, żebym uprawiał bragga."
hiphop,"Nikt nie mówi łamaga, gdy hardcoreu nie uprawiam."
hiphop,"Gdy piszę życiówkę to nie kłamię, prawdę gadam."
hiphop,A szajsu nie poskładam nawet gdybyś o to błagał.
hiphop,"Nie ma tego złego, co na dobre by nie wyszło."
hiphop,Umiem zjebać wszystko i na zgliszczach od początku.
hiphop,"Zbudować nowy dom, to kilka nowych wątków."
hiphop,"W muzyce być w porządku, nigdy nie zawiodłem ziomków."
hiphop,"Za dobry powiedziałem, dedykowane"
hiphop,"Mym ludziom ten balet, ja się wcale nie chwalę."
hiphop,Co miałem oddałem od siebie to ten szmalec.
hiphop,"To twórczo się wpisuje, na stałe w te kabałę."
hiphop,Oto nowy joyek jak i w Sun Lloret.
hiphop,Na najwyższym poziomie to rapowy gnojek powie.
hiphop,Warsztat unikat. Dlaczego? nie wnikaj.
hiphop,"Masz syf w głośnikach, z parkietu nie znikaj."
hiphop,"Nie lubisz mnie, zdychaj, z tej impry się zawiń."
hiphop,"Lub naładuj karabin, jeśli koniecznie chcesz mnie zabić."
hiphop,"Ten co nie dał się zwabić w pułapkę, to mój atut."
hiphop,Narobić hałasu i utrzymać gwiazdy status.
hiphop,Tylu kutasów by chciało mieć to co ja.
hiphop,"Być jak ja, grać jak ja, żyć jak ja, ha ha!"
hiphop,"Rychu będzie grał to nadal, journalista będzie badał."
hiphop,"A jak zawistniak gadał, tylko ten co mi zazdrościł."
hiphop,"Świat bez litości szybko, pozbawił mnie złudzeń."
hiphop,"Wybrać cierpienie czy nudę? Proste, że to pierwsze."
hiphop,"Operuję wierszem, tego tracku nie spieprzę."
hiphop,Masz tu człowieku całkiem hardcoreową wersję.
hiphop,"Nikt ode mnie nie wymaga, żebym uprawiał bragga."
hiphop,"Nikt nie mówi łamaga, gdy hardcoreu nie uprawiam."
hiphop,"Gdy piszę życiówkę to nie kłamię, prawdę gadam."
hiphop,"A szajsu nie poskładam nawet, gdybyś o to błagał."
hiphop,"Ten pot, te łzy, ta krew, ta jedna miłość."
hiphop,"Oto z micem zażyłość, co odbiera mi zmysły."
hiphop,"Wizerunek artysty, to człowiek z krwi i kości."
hiphop,"Przy micu nie pości, w gronie znakomitości."
hiphop,Jak ten przyblokowy chwast na pełnym oficjalu.
hiphop,Jak ten zadymiarski chlast na toksycznym nielegalu.
hiphop,"Prowadzę się powoli, a niektórych bardzo boli."
hiphop,"Fakt, że sobie radzę i co na to poradzę?"
hiphop,"Środkowy palec raczej, tak czy inaczej."
hiphop,Jestem w grze i zaznaczę - nigdzie się nie wybieram.
hiphop,"Przy micu, adapterach, to Rycha gadka szczera."
hiphop,"Ryja wydzieram, aż po zapalenie krtani."
hiphop,"Potrafię ranić i sprawić, że się spalisz."
hiphop,"Z nami zabawisz, odlecisz, nie dać się zabić."
hiphop,"Mistrzowskie życie, jestem jego projektantem."
hiphop,"Nie będę palantem, który nie ma planów marzeń."
hiphop,"Jak moje tatuaże, kolejny w życiu przełom"
hiphop,"Odnotuję to, jak na skórze nowe dzieło."
hiphop,"A ty będziesz się przyglądał, jak milczący świadek w cieniu."
hiphop,"Wyjdź naprzeciw zdarzeniom, na światło dzienne tlenu."
hiphop,"Tańcz, śmiej się, kasuj zawczasu, pierdol brednie."
hiphop,"Czy bardzo dobry rap, ma oznaczać życie biedne?"
hiphop,"Gdzie tak napisano, że za rap nie płacą siano?"
hiphop,Ważne by utrzymać wymarzoną posiadłość.
hiphop,"Chcesz ogłosić upadłość? Proszę bardzo, beze mnie."
hiphop,Jeszcze raz ci powtórzyć? Powtarzam - pierdol brednie.
hiphop,"Wracaj pod trzepak, tam na ciebie nikt nie czeka."
hiphop,"Prócz nieudacznika, zabij w sobie człowieka."
hiphop,"A ja tak nie chcę, nie zwlekam żyć na stówę."
hiphop,"Apetyt mam wilczy na życie, uwierz."
hiphop,"Nikt ode mnie nie wymaga, żebym uprawiał bragga."
hiphop,"Nikt nie mówi łamaga, gdy hardcoreu nie uprawiam."
hiphop,"Gdy piszę życiówkę to nie kłamię, prawdę gadam."
hiphop,"A szajsu nie poskładam nawet, gdybyś o to błagał."
hiphop,Znasz mnie lepiej niż ja siebie?
hiphop,Widziałeś mnie na glebie?
hiphop,Znasz upadek i cierpienie?
hiphop,"Znasz każde wydarzenie,"
hiphop,Które miało wpływ na mnie?
hiphop,Znasz mnie lepiej niż ja klaunie? (kłamiesz)
hiphop,"Chcesz, by twa wyobraźnia mogła cię oszukać?"
hiphop,"Znać P to sztuka, wystarczy P posłuchać,"
hiphop,"Przeczytać jeden wywiad, porozmawiać prywatnie"
hiphop,P nie chce się zwierzać
hiphop,"A to kurwa nie ładnie,"
hiphop,"P nie robi uczciwie,"
hiphop,P bankowo nadal kradnie.
hiphop,"Nie ważne że robota jest trudna,"
hiphop,"Nie ogarnę tego wszystkiego naraz,"
hiphop,"Nie wyrobie się zaraz,"
hiphop,"Nie lubisz bakterii,"
hiphop,"Bo mnie nie znasz nie od dzisiaj,"
hiphop,"Wiem, że w tobie Rychu Peja nie znajdzie kibica"
hiphop,Jak mnie to nie zachwyca
hiphop,"Śmieszą teorie mętu,"
hiphop,Ty znasz Rycha Peję
hiphop,Już na samym wejściu
hiphop,"Ma być struty, bo zarzuty,"
hiphop,Które padną są prawdą?
hiphop,"Gadaj zdrów, wiem kim jestem,"
hiphop,Więc złoczyńcy odpadną!
hiphop,"Na to źle nie życzę,"
hiphop,"Wypierdalaj, nie krzyczę"
hiphop,Spokojnie na tym bicie
hiphop,Ze słowami w zeszycie.
hiphop,Opowiadam jak widzicie
hiphop,Rycha Peję ja się śmieję.
hiphop,W niekorzystnym świetle
hiphop,"Stawiać chcą poryte dekle,"
hiphop,"Żal ci dupę ściska,"
hiphop,Tylko na tym znasz się biegle
hiphop,"Wbijać szpilę, głodne wilki"
hiphop,Chcące pożreć Okuckiego
hiphop,Weź odpierdol się od niego
hiphop,A nie będzie boju tego...
hiphop,"Odpierdol się od niego, nie będzie boju tego.."
hiphop,Co cię boli?
hiphop,"Czy aż tak cię to boli,"
hiphop,Że Rychu Peja ma szansę
hiphop,Dziś uczciwie zarobić?
hiphop,"Przyjemne z pożytecznym,"
hiphop,"Pasja życiowa rap,"
hiphop,Ja za ciebie nic nie zrobię
hiphop,A ty dziobem kłap kłap.
hiphop,"Nierobie pierdolony,"
hiphop,"Zawistny Polaku,"
hiphop,"Zacznij zmieniać swoje życie,"
hiphop,"Jak nie chcesz żreć ochłapów,"
hiphop,"Zrób coś! Słyszysz? Zacznij żyć własnym życiem,"
hiphop,Kłapnij jeszcze raz usłyszysz o tym na płycie!
hiphop,(Hej! Ty! Wy! Oni!)
hiphop,(Co was boli?
hiphop,Co was kurwy boli?)
hiphop,"Zauważasz sprzedaż płyt,"
hiphop,"Nie widzisz potu na skroni,"
